Id,Station,Address,Latitude,Longitude
1,Abbey Road,"Abbey Road, London E15, UK",51.53193,0.00376
2,Abbey Wood,"Abbey Wood, London SE2, UK",51.494107,0.121262
3,Aber,"Aber, Gwynedd LL33, UK",53.236641,-4.024252
4,Abercynon,"Abercynon, Rhondda Cynon Taff, UK",51.647512,-3.3293529
5,Abercynon,"Abercynon, Rhondda Cynon Taff, UK",51.647512,-3.3293529
6,Abercynon North,"Abercynon, Rhondda Cynon Taff, UK",51.647512,-3.3293529
7,Aberdare,"Aberdare, Rhondda Cynon Taff CF44, UK",51.716154,-3.451816
8,Aberdeen,"Aberdeen, Aberdeen City, UK",57.149717,-2.094278
9,Aberdour,"Aberdour, Fife, UK",56.054679,-3.30273
10,Aberdovey,"Aberdovey, Gwynedd, UK",52.543963,-4.046093
11,Abererch,"Abererch, Gwynedd LL53, UK",52.903768,-4.381498
12,Abergavenny,"Abergavenny, Monmouthshire NP7, UK",51.825366,-3.019423
13,Abergele & Pensarn,"Abergele & Pensarn, Pensarn, Conwy LL22, UK",53.2945886,-3.582625
14,Aberystwyth,"Aberystwyth, Ceredigion, UK",52.415303,-4.08292
15,Accrington,"Accrington, Lancashire, UK",53.753609,-2.37218
16,Achanalt,"Achanalt, Garve, Highland IV23, UK",57.6095764,-4.913846
17,Achnasheen,"Achnasheen, Highland IV22, UK",57.581087,-5.082511
18,Achnashellach,"Achnashellach, Strathcarron, Highland IV54, UK",57.4820517,-5.3330495
19,Acklington,"Acklington, Northumberland NE65, UK",55.309754,-1.64182
20,Acle,"Acle, Norfolk NR13, UK",52.638278,1.550643
21,Acocks Green,"Acocks Green, Birmingham, West Midlands B27, UK",52.443155,-1.829907
22,Acton Bridge,"Acton Bridge, Cheshire West and Chester CW8, UK",53.27404,-2.607693
23,Acton Central,"Acton Central, London W3, UK",51.5087157,-0.2629476
24,Acton Main Line,"Acton Main Line, London W3, UK",51.5171797,-0.2667333
25,Acton Town,"Acton Town, London W3, UK",51.50306,-0.28044
26,Adderley Park,"Adderley Park, Birmingham, West Midlands B8, UK",52.4830988,-1.8559396
27,Addiewell,"Addiewell, West Lothian, UK",55.845341,-3.614513
28,Addington Village,"Addington, Kent ME19, UK",51.305996,0.3745839
29,Addlestone,"Addlestone, Surrey, UK",51.369813,-0.488641
30,Adisham,"Adisham, Kent CT3, UK",51.240668,1.187223
31,Adlington (Cheshire),"Adlington (Cheshire), Macclesfield, Cheshire East SK10, UK",53.3195696,-2.1335616
32,Adlington (Lancashire),"Adlington, Lancashire, UK",53.611055,-2.606365
33,Adwick,"Adwick upon Dearne, South Yorkshire, UK",53.510281,-1.293788
34,Aigburth,"Aigburth, Liverpool, Merseyside L17, UK",53.367285,-2.924288
35,Ainsdale,"Ainsdale, Southport, Merseyside PR8, UK",53.602375,-3.037908
36,Aintree,"Aintree, Liverpool, Merseyside L10, UK",53.479322,-2.937284
37,Airbles,"Airbles, Motherwell, North Lanarkshire ML1, UK",55.7828282,-3.9941847
38,Airdrie,"Airdrie, North Lanarkshire, UK",55.866267,-3.962566
39,Albany Park,"Albany Park, Chicago, IL, USA",41.9689723,-87.7197245
40,Albrighton,"Albrighton, Shropshire, UK",52.633035,-2.28022
41,Alderley Edge,"Alderley Edge, Cheshire East, UK",53.301554,-2.237216
42,Aldermaston,"Aldermaston, West Berkshire RG7, UK",51.384033,-1.155134
43,Aldershot,"Aldershot, Hampshire, UK",51.248366,-0.7557509
44,Aldgate,"Aldgate SA 5154, Australia",-35.0151752,138.735877
45,Aldgate East,"Aldgate East, London E1, UK",51.51504,-0.07236
46,Aldrington,"Aldrington, Hove, The City of Brighton and Hove BN3, UK",50.834494,-0.190758
47,Alexandra Palace,"Alexandra Palace, Alexandra Palace Way, Wood Green, London N22 7AY, UK",51.593642,-0.131921
48,Alexandra Parade,"Alexandra Parade, Glasgow, Glasgow City G31, UK",55.8631647,-4.2106341
49,Alexandria,"Alexandria, Alexandria Governorate, Egypt",31.2000924,29.9187387
50,Alfreton,"Alfreton, Derbyshire DE55, UK",53.09745,-1.382256
51,Allen's West,"Allens West, Stockton-on-Tees TS16, UK",54.5246329,-1.3611286
52,Alloa,"Alloa, Clackmannanshire, UK",56.114073,-3.791896
53,All Saints,"All Saints, Poplar, London E14, UK",51.511,-0.01311
54,Alness,"Alness, Highland, UK",57.695955,-4.256825
55,Alnmouth,"Alnmouth, Northumberland NE66, UK",55.386945,-1.611864
56,Alperton,"Alperton, Wembley, Greater London HA0, UK",51.539896,-0.290454
57,Alresford,"Alresford, Hampshire SO24, UK",51.090113,-1.165786
58,Alsager,"Alsager, Cheshire East ST7, UK",53.095402,-2.304657
59,Althorne,"Althorne, Essex CM3, UK",51.65453,0.763506
60,Althorpe,"Althorp, Northamptonshire NN7, UK",52.28,-1
61,Altnabreac,"Altnabreac, Halkirk, Highland KW12, UK",58.388133,-3.7062872
62,Alton,"Alton, Hampshire GU34, UK",51.150719,-0.973177
63,Altrincham,"Altrincham, UK",53.39018,-2.350904
64,Alvechurch,"Alvechurch, Worcestershire, UK",52.351897,-1.96031
65,Ambergate,"Ambergate, Derbyshire DE56, UK",53.061472,-1.483764
66,Amberley,"Amberley, West Sussex BN18, UK",50.90654,-0.533927
67,Amersham,"Amersham, Buckinghamshire, UK",51.6755179,-0.607241
68,Amersham (Underground),"Amersham, Buckinghamshire, UK",51.6755179,-0.607241
69,Ammanford,"Ammanford, Carmarthenshire, UK",51.792888,-3.988459
70,Ampere Way,"Ampere Way, Croydon, Greater London CR0 4UZ, UK",51.3819791,-0.123944
71,Ancaster,"Ancaster, Hamilton, ON, Canada",43.2177791,-79.9872835
72,Andover,"Andover, Hampshire, UK",51.2111975,-1.4919233
73,Anerley,"Anerley, London SE20, UK",51.408661,-0.059686
74,Angel,"Angel, London N1, UK",51.53262,-0.10587
75,Angel Road,"Angel Road, London N18, UK",51.6124048,-0.0487663
76,Angmering,"Angmering, West Sussex, UK",50.829189,-0.483919
77,Annan,"Annan, Dumfries and Galloway DG12, UK",54.990246,-3.259773
78,Anniesland,"Anniesland, Glasgow, Glasgow City G13, UK",55.8901749,-4.3254629
79,Ansdell & Fairhaven,"Ansdell & Fairhaven, Lytham Saint Annes, Lancashire FY8, UK",53.7414756,-2.9930314
80,Appleby,"Appleby, North Lincolnshire DN15, UK",53.622283,-0.566632
81,Appledore,"Appledore, Devon, UK",51.053778,-4.193056
82,Appleford,"Appleford, Oxfordshire OX14, UK",51.640009,-1.2409889
83,Appley Bridge,"Appley Bridge, Lancashire, UK",53.584356,-2.722712
84,Apsley,"Apsley VIC 3319, Australia",-36.9685451,141.08323
85,Arbroath,"Arbroath, Angus, UK",56.559107,-2.591543
86,Archway,"Archway, London N19, UK",51.56548,-0.13479
87,Ardgay,"Ardgay, Highland IV24, UK",57.881213,-4.363214
88,Ardlui,"Ardlui, Argyll and Bute G83, UK",56.301669,-4.722054
89,Ardrossan Harbour,"Ardrossan Harbour, Ardrossan, North Ayrshire KA22, UK",55.6398685,-4.8210877
90,Ardrossan South Beach,"Ardrossan South Beach, Ardrossan, North Ayrshire KA22, UK",55.6414124,-4.8011891
91,Ardrossan Town,"Ardrossan Town, Ardrossan, North Ayrshire KA22, UK",55.6397027,-4.8126526
92,Arena,"Arena, London SE25, UK",51.39152,-0.05832
93,Argyle Street,"Argyle Street, Glasgow, Glasgow City, UK",55.8618535,-4.2725519
94,Arisaig,"Arisaig, Highland PH39, UK",56.909856,-5.843095
95,Arlesey,"Arlesey, Central Bedfordshire, UK",52.015347,-0.26326
96,Armadale,"Armadale, West Lothian EH48, UK",55.897742,-3.702162
97,Armathwaite,"Armathwaite, Cumbria CA4, UK",54.807416,-2.770024
98,Arnos Grove,"Arnos Grove, London N11, UK",51.61645,-0.13304
99,Arnside,"Arnside, Cumbria, UK",54.203808,-2.832755
100,Arram,"Arram, East Riding of Yorkshire HU17, UK",53.883091,-0.417271
101,Arrochar & Tarbet,"Arrochar & Tarbet, Arrochar, Argyll and Bute G83, UK",56.2039605,-4.7227534
102,Arsenal,"Arsenal, London N5, UK",51.55865,-0.10743
103,Arundel,"Arundel, West Sussex BN18, UK",50.855171,-0.555119
104,Ascot,"Ascot, Windsor and Maidenhead SL5, UK",51.4091845,-0.6725824
105,Ascott-Under-Wychwood,"Ascott-under-Wychwood, Oxfordshire OX7, UK",51.865885,-1.563271
106,Ash,"Ash House, Lancaster University, Lancaster, Lancashire LA1 4YT, UK",54.011946,-2.7862717
107,Ashburys,"Ashburys, Manchester M12, UK",53.4716522,-2.1944348
108,Ashchurch,"Ashchurch, Gloucestershire GL20, UK",51.997775,-2.1047349
109,Ashfield,"Ashfield NSW 2131, Australia",-33.8885698,151.1241979
110,Ashford International,"Ashford International, Ashford, Kent TN23, UK",51.1437037,0.8762284
111,Ashford (Middlesex),"Ashford Drive, Plainsboro Township, NJ 08536, USA",40.3263717,-74.5613572
112,Ashley,"Ashley, Altrincham, Cheshire East WA15, UK",53.3560094,-2.3410104
113,Ashtead,"Ashtead, Surrey, UK",51.310684,-0.296968
114,Ashton-Under-Lyne,"Ashton-under-Lyne, UK",53.494245,-2.104057
115,Ashurst,"Ashurst, Hampshire SO40, UK",50.89754,-1.517259
116,Ashurst New Forest,"Ashurst New Forest, New Forest National Park, Southampton, Hampshire SO40, UK",50.8898408,-1.526623
117,Ash Vale,"Ash Vale, Surrey, UK",51.264376,-0.7219719
118,Ashwell & Morden,"Ashwell & Morden, Baldock, Cambridgeshire SG7, UK",52.0307802,-0.1097608
119,Askam,"Askam, Askam-in-Furness, Cumbria LA16, UK",54.1889366,-3.2045107
120,Aslockton,"Aslockton, Nottinghamshire NG13, UK",52.953347,-0.894771
121,Aspatria,"Aspatria, Cumbria CA7, UK",54.763442,-3.333129
122,Aspley Guise,"Aspley Guise, Central Bedfordshire, UK",52.010696,-0.62743
123,Aston,"Aston, South Yorkshire, UK",53.3630179,-1.29214
124,Atherstone,"Atherstone, Warwickshire CV9, UK",52.576614,-1.543763
125,Atherton,"Atherton, UK",53.524011,-2.49227
126,Attadale,"Attadale WA 6156, Australia",-32.0314195,115.8093273
127,Attenborough,"Attenborough, Nottingham, Nottinghamshire NG9, UK",52.906541,-1.231287
128,Attleborough,"Attleborough, Norfolk, UK",52.518064,1.015527
129,Auchinleck,"Auchinleck, East Ayrshire KA18, UK",55.473388,-4.298566
130,Audley End,"Audley End, Essex CB11, UK",52.019705,0.224046
131,Aughton Park,"Aughton Park, Aughton, Lancashire L39, UK",53.5542617,-2.895219
132,Avenue Road,"Avenue Road, Lurgan, Craigavon BT66 7BB, UK",54.4586531,-6.3196682
133,Aviemore,"Aviemore, Highland PH22, UK",57.19449,-3.823812
134,Avoncliff,"Avoncliff, Wiltshire BA15, UK",51.3382755,-2.2821682
135,Avonmouth,"Avonmouth, Bristol, City of Bristol BS11, UK",51.503457,-2.698444
136,Axminster,"Axminster, Devon EX13, UK",50.782727,-2.994937
137,Aylesbury,"Aylesbury, Buckinghamshire, UK",51.815606,-0.8084
138,Aylesbury Vale Parkway,"Aylesbury Vale Parkway, Aylesbury, Buckinghamshire HP18, UK",51.8311642,-0.86016
139,Aylesford,"Aylesford, Kent ME20, UK",51.304309,0.47806
140,Aylesham,"Aylesham, Kent, UK",51.2251035,1.2008551
141,Ayr,"Ayr, South Ayrshire, UK",55.458564,-4.629179
142,Bache,"Bache, Shropshire SY7, UK",52.431615,-2.782749
143,Baglan,"Baglan, Neath Port Talbot, UK",51.619954,-3.814203
144,Bagshot,"Bagshot, Surrey, UK",51.360343,-0.697894
145,Baildon,"Baildon, West Yorkshire, UK",53.852716,-1.768142
146,Baillieston,"Baillieston, Glasgow, Glasgow City, UK",55.8512984,-4.1159938
147,Baker Street,"Baker Street, Orsett, Thurrock RM16, UK",51.507805,0.351672
148,Balcombe,"Balcombe, West Sussex RH17, UK",51.058563,-0.12794
149,Baldock,"Baldock, Hertfordshire, UK",51.9895039,-0.189128
150,Balham,"08190 Balham, France",49.49134,4.160311
151,Balloch,"Balloch, West Dunbartonshire, UK",56.002716,-4.580081
152,Balmossie,"Balmossie, Monifieth, Angus DD5, UK",56.4745545,-2.8389592
153,Bamber Bridge,"Bamber Bridge, Lancashire PR5, UK",53.7323749,-2.6612285
154,Bamford,"Bamford, Derbyshire S33, UK",53.34863,-1.686771
155,Banavie,"Banavie, Highland PH33, UK",56.845288,-5.098736
156,Banbury,"Banbury, Oxfordshire, UK",52.0629009,-1.339775
157,Bangor (Gwynedd),"Bangor, Gwynedd, UK",53.22739,-4.129263
158,Bank,"Bank, London EC3V, UK",51.51323,-0.08849
159,Bank Hall,"Bank Hall, Liverpool, Merseyside L20, UK",53.4375082,-2.9875108
160,Banstead,"Banstead, Surrey, UK",51.3221909,-0.205046
161,Barassie,"Barassie, Troon, South Ayrshire KA10, UK",55.5610565,-4.6511179
162,Barbican,"Barbican, London EC2Y, UK",51.5190925,-0.0940787
163,Bardon Mill,"Bardon Mill, Northumberland NE47, UK",54.975089,-2.3428619
164,Bare Lane,"Bare Lane, Morecambe, Lancashire LA4, UK",54.0745503,-2.8353283
165,Bargeddie,"Bargeddie, North Lanarkshire, UK",55.8540587,-4.0784306
166,Bargoed,"Bargoed, Caerphilly, UK",51.684912,-3.229699
167,Barking,"Barking, Greater London, UK",51.536563,0.075766
168,Barkingside,"Barkingside, Ilford, Greater London IG6, UK",51.588711,0.081188
169,Barking (Underground),"Upney Underground Station, Upney Lane, Barking, Greater London IG11 9LS, UK",51.5384059,0.1015318
170,Barlaston,"Barlaston, Staffordshire, UK",52.945556,-2.158722
171,Barming,"Barming, Kent, UK",51.2649041,0.4584923
172,Barmouth,"Barmouth, Gwynedd, UK",52.722873,-4.0560919
173,Barnehurst,"Barnehurst, Bexleyheath, Greater London DA7, UK",51.460893,0.165643
174,Barnes,"Barnes, ND, USA",46.926176,-98.1222338
175,Barnes Bridge,"Barnes Bridge, London SW13, UK",51.4720071,-0.252607
176,Barnetby,"Barnetby le Wold, North Lincolnshire DN38, UK",53.571456,-0.403125
177,Barnham,"Barnham, West Sussex, UK",50.827758,-0.635749
178,Barnhill,"Barnhill, Cheshire West and Chester CH3, UK",53.08396,-2.762932
179,Barnsley,"Barnsley, South Yorkshire, UK",53.55263,-1.479726
180,Barnstaple,"Barnstaple, Devon, UK",51.0781599,-4.058338
181,Barnt Green,"Barnt Green, Worcestershire, UK",52.359707,-1.991617
182,Barons Court,"Barons Court, London W14, UK",51.49031,-0.2134
183,Barrhead,"Barrhead, AB, Canada",54.1230722,-114.4016742
184,Barrhill,"Barrhill, South Ayrshire KA26, UK",55.101337,-4.764535
185,Barrow Haven,"Barrow Haven, North Lincolnshire DN19, UK",53.693394,-0.392823
186,Barrow-In-Furness,"Barrow-in-Furness, Cumbria, UK",54.108967,-3.218894
187,Barrow-Upon-Soar,"Barrow upon Soar, Leicestershire LE12, UK",52.7524019,-1.148755
188,Barry,"Barra, United Kingdom",56.9808838,-7.4567959
189,Barry Docks,"Barry Docks, Barry, Vale of Glamorgan CF63, UK",51.4024389,-3.2607137
190,Barry Island,"Barra, United Kingdom",56.9808838,-7.4567959
191,Barton-On-Humber,"Barton-upon-Humber, North Lincolnshire, UK",53.686675,-0.443368
192,Basildon,"Basildon, Essex, UK",51.576084,0.488736
193,Basingstoke,"Basingstoke, Hampshire, UK",51.262551,-1.093609
194,Bat & Ball,"Bat & Ball, Sevenoaks, Kent TN14, UK",51.2897577,0.1942548
195,Bathgate,"Bathgate, West Lothian, UK",55.9024,-3.643118
196,Bath Spa,"Bath Spa University, Bath, Bath and North East Somerset BA2 9BN, UK",51.3758998,-2.4386609
197,Batley,"Batley, West Yorkshire, UK",53.717028,-1.635083
198,Battersby,"Battersby, North Yorkshire YO21, UK",54.462891,-1.078955
199,Battersea Park,"Battersea Park, London SW11 4NJ, United Kingdom",51.4791075,-0.1564981
200,Battle,"Battle, East Sussex, UK",50.917405,0.483679
201,Battlesbridge,"Battlesbridge, Essex SS11, UK",51.622615,0.571876
202,Bayford,"Bayford, Hertfordshire SG13, UK",51.757722,-0.104772
203,Beaconsfield,"Beaconsfield, Buckinghamshire, UK",51.602396,-0.6442409
204,Bearley,"Bearley, Warwickshire CV37, UK",52.244441,-1.739343
205,Bearsden,"Bearsden, East Dunbartonshire, UK",55.92169,-4.335525
206,Bearsted,"Bearsted, Kent, UK",51.2744349,0.578956
207,Beasdale,"Beasdale, Arisaig, Highland PH39, UK",56.8995321,-5.7637825
208,Beaulieu Road,"Beaulieu Road, New Forest National Park, Brockenhurst, Hampshire SO42, UK",50.8550379,-1.50474
209,Beauly,"Beauly, Highland IV4, UK",57.483411,-4.460351
210,Bebington,"Bebington, Merseyside CH63, UK",53.351175,-3.006884
211,Beccles,"Beccles, Suffolk NR34, UK",52.459333,1.566053
212,Beckenham Hill,"Beckenham Hill, London SE6, UK",51.4245804,-0.0159249
213,Beckenham Junction,"Beckenham Junction, Beckenham, Greater London BR3, UK",51.4111711,-0.0259962
214,Beckenham Junction (Tram),"Beckenham, Greater London, UK",51.40817,-0.025813
215,Beckenham Road,"Beckenham Road, Beckenham, Greater London BR3, UK",51.40953,-0.04339
216,Beckton,"Beckton, London E6, UK",51.51436,0.06148
217,Beckton Park,"Beckton Park, London E6, UK",51.50879,0.05496
218,Becontree,"Becontree, Dagenham, Greater London RM9, UK",51.54033,0.12704
219,Beddington Lane,"Beddington Lane, Croydon, Greater London CR0, UK",51.38924,-0.14214
220,Bedford Midland,"Midland Road, Bedford MK40, UK",52.1359658,-0.4723635
221,Bedford St.Johns,"Bedford St Johns, Bedford MK42, UK",52.1294885,-0.4674792
222,Bedhampton,"Bedhampton, Havant, Hampshire PO9, UK",50.854655,-1.004007
223,Bedworth,"Bedworth, Warwickshire, UK",52.481392,-1.468869
224,Bedwyn,"Great Bedwyn, Wiltshire SN8, UK",51.37982,-1.602843
225,Beeston,"Beeston, Nottinghamshire, UK",52.92392,-1.212394
226,Bekesbourne,"Bekesbourne, Kent CT4, UK",51.258071,1.142522
227,Belgrave Walk,"Belgrave Walk, Mitcham, Greater London CR4, UK",51.40096,-0.17849
228,Belle Vue,"Belle Vue, Bude, Cornwall EX23 8JL, UK",50.8304789,-4.5451651
229,Bellgrove,"Bellgrove, Glasgow, Glasgow City G31, UK",55.8566981,-4.2243599
230,Bellingham,"Bellingham, WA, USA",48.7595529,-122.4882249
231,Bellshill,"Bellshill, North Lanarkshire, UK",55.816761,-4.026536
232,Belmont,"Belmont, CA, USA",37.5202145,-122.2758008
233,Belper,"Belper, Derbyshire DE56, UK",53.0243899,-1.477616
234,Belsize Park,"Belsize Park, London NW3, UK",51.550187,-0.166274
235,Beltring,"Beltring, Kent TN12, UK",51.203232,0.396575
236,Belvedere,"Belvedere, Greater London, UK",51.485165,0.14827
237,Bempton,"Bempton, East Riding of Yorkshire YO15, UK",54.131186,-0.17859
238,Benfleet,"Benfleet SS7, UK",51.5661671,0.5792812
239,Ben Rhydding,"Ben Rhydding, Ilkley, West Yorkshire LS29, UK",53.919118,-1.790682
240,Bentham,"Bentham, North Yorkshire LA2, UK",54.1180014,-2.5090175
241,Bentley,"Bentley, South Yorkshire, UK",53.5476953,-1.1454921
242,Bentley (S. Yorks),"Bentley, South Yorkshire, UK",53.5476953,-1.1454921
243,Bere Alston,"Bere Alston, Devon PL20, UK",50.481561,-4.186218
244,Bere Ferrers,"Bere Ferrers, Devon PL20, UK",50.451308,-4.171239
245,Berkhamsted,"Berkhamsted, Hertfordshire, UK",51.759766,-0.5678569
246,Berkswell,"Berkswell, West Midlands CV7, UK",52.4096959,-1.639577
247,Bermondsey,"Bermondsey, London SE16, UK",51.4985821,-0.0691276
248,Berney Arms,"Berney Arms, Burgh Castle, Norfolk NR30, UK",52.58926,1.6322509
249,Berry Brow,"Berry Brow, Huddersfield, West Yorkshire HD4, UK",53.6249449,-1.792133
250,Berrylands,"Berrylands, Kingston upon Thames, Greater London KT5, UK",51.3990427,-0.2806909
251,Berwick (Sussex),"Berwick (Sussex), Polegate, East Sussex BN26, UK",50.8403713,0.1660452
252,Berwick-Upon-Tweed,"Berwick-upon-Tweed, Northumberland, UK",55.770242,-2.005395
253,Bescar Lane,"Bescar Lane, Scarisbrick, Lancashire L40, UK",53.6238667,-2.9146097
254,Bescot Stadium,"Bescot Stadium, Wednesbury, West Midlands WS1, UK",52.563107,-1.9911
255,Betchworth,"Betchworth, Surrey, UK",51.240523,-0.267364
256,Bethnal Green,"Bethnal Green, London E2, UK",51.5269736,-0.0667204
257,Bethnal Green (Underground),"Bethnal Green, London E2, UK",51.5269736,-0.0667204
258,Betws-y-Coed,"Betws-y-Coed, Conwy LL24, UK",53.089918,-3.80065
259,Beverley,"Beverley, East Riding of Yorkshire HU17, UK",53.841963,-0.435093
260,Bexhill,"Bexhill, East Sussex, UK",50.851292,0.457048
261,Bexley,"Bexley, Greater London, UK",51.439933,0.154327
262,Bexleyheath,"Bexleyheath, Greater London, UK",51.453341,0.13822
263,Bicester North,"Bicester North, Bicester, Oxfordshire OX26, UK",51.903489,-1.1503638
264,Bicester Town,"Bicester, Oxfordshire, UK",51.899603,-1.1535899
265,Bickley,"Bickley, Bromley, Greater London BR1, UK",51.401857,0.052503
266,Bidston,"Bidston, Birkenhead, Merseyside CH43, UK",53.402125,-3.078337
267,Biggleswade,"Biggleswade, Central Bedfordshire, UK",52.086938,-0.26422
268,Bilbrook,"Bilbrook, Staffordshire, UK",52.63519,-2.1515689
269,Billericay,"Billericay, Essex, UK",51.627903,0.418397
270,Billingham,"Billingham, Stockton-on-Tees, UK",54.612537,-1.290961
271,Billingshurst,"Billingshurst, West Sussex RH14, UK",51.022909,-0.451462
272,Bingham,"Bingham, Nottinghamshire NG13, UK",52.951088,-0.956144
273,Bingley,"Bingley, West Yorkshire, UK",53.847389,-1.833781
274,Birchgrove,"Birchgrove NSW 2041, Australia",-33.8530103,151.1814297
275,Birchington-On-Sea,"Birchington, Kent, UK",51.373347,1.306532
276,Birchwood,"Birchwood, Warrington, UK",53.416602,-2.523856
277,Birkbeck,"Birkbeck, Beckenham, Greater London BR3, UK",51.4038889,-0.0557124
278,Birkdale,"Birkdale, North Yorkshire DL11, UK",54.406371,-2.2272429
279,Birkenhead Central,"Birkenhead Central, Birkenhead, Merseyside CH41, UK",53.3883288,-3.0208204
280,Birkenhead Hamilton Square,"Birkenhead Hamilton Square, Birkenhead, Merseyside CH41, UK",53.3947091,-3.0136794
281,Birkenhead North,"Birkenhead North, Birkenhead, Merseyside CH41, UK",53.4044504,-3.0575319
282,Birkenhead Park,"Birkenhead Park, Birkenhead, Merseyside CH41, UK",53.397421,-3.0391
283,Birmingham Bordesley,"Bordesley, Birmingham, West Midlands B9, UK",52.4757763,-1.8751346
284,Birmingham International,"Birmingham International, Birmingham, West Midlands B40, UK",52.4508199,-1.7258496
285,Birmingham Moor Street,"Birmingham Moor Street, Birmingham, West Midlands B4, UK",52.4790921,-1.8924676
286,Birmingham New Street,"Birmingham New Street, Birmingham, West Midlands B5, UK",52.4777938,-1.89836
287,Birmingham Snow Hill,"Birmingham Snow Hill, Birmingham, West Midlands B3, UK",52.4833682,-1.8990834
288,Birmingham Snow Hill (Tram),"Birmingham, West Midlands, UK",52.486243,-1.890401
289,Bishop Auckland,"Bishop Auckland, County Durham, UK",54.663822,-1.678788
290,Bishopbriggs,"Bishopbriggs, East Dunbartonshire, UK",55.904185,-4.228494
291,Bishopstone,"Bishopstone, East Sussex BN25, UK",50.7902284,0.0886266
292,Bishopton,"Bishopton, Renfrewshire PA7, UK",55.908622,-4.50452
293,Bitterne,"Bitterne, Southampton SO18, UK",50.916606,-1.356652
294,Blackburn,"Blackburn, Blackburn with Darwen, UK",53.748575,-2.487529
295,Blackfriars,"London Blackfriars, London EC4V, UK",51.5118096,-0.1033063
296,Blackheath,"Blackheath NSW 2785, Australia",-33.6356669,150.2853372
297,Blackhorse Lane,"Blackhorse Lane, London E17 6HJ, UK",51.5930335,-0.0400656
298,Blackhorse Road,"Blackhorse Road, London E17, UK",51.58692,-0.04112
299,Black Lake,"Black Lake, Tittensor, Staffordshire ST4, UK",52.9531194,-2.2155825
300,Blackpool North,"Blackpool North, Blackpool FY1, UK",53.8219273,-3.0492706
301,Blackpool Pleasure Beach,"Blackpool Pleasure Beach, 525 Ocean Blvd, Blackpool, Lancashire FY4 1EZ, UK",53.79233,-3.0552927
302,Blackpool South,"Blackpool South, Blackpool FY4, UK",53.7987135,-3.0489346
303,Blackridge,"Blackridge, West Lothian EH48, UK",55.885995,-3.774297
304,Blackrod,"Blackrod, UK",53.5873599,-2.57864
305,Blackwall,"Blackwall, Poplar, London E14, UK",51.50799,-0.00694
306,Blackwater,"Blackwater QLD 4717, Australia",-23.5755145,148.8886132
307,Blaenau Ffestiniog,"Blaenau Ffestiniog, Gwynedd LL41, UK",52.998337,-3.944894
308,Blair Atholl,"Blair Atholl, Perth and Kinross PH18, UK",56.768184,-3.843385
309,Blakedown,"Blakedown, Worcestershire, UK",52.403886,-2.179618
310,Blake Street,"Blake Street, Sutton Coldfield, West Midlands B74, UK",52.6048991,-1.8449075
311,Blantyre,"Blantyre, South Lanarkshire, UK",55.793868,-4.09492
312,Blaydon,"Blaydon, Tyne and Wear NE21, UK",54.962993,-1.71867
313,Bleasby,"Bleasby, Nottinghamshire NG14, UK",53.037614,-0.934305
314,Bletchley,"Bletchley, Milton Keynes, UK",52.002175,-0.750137
315,Bloxwich,"Bloxwich, Walsall, West Midlands, UK",52.6150309,-2.0009708
316,Bloxwich North,"Bloxwich North, Walsall, West Midlands WS3, UK",52.6254506,-2.0176784
317,Blundellsands & Crosby,"Blundellsands & Crosby, Waterloo, Merseyside L23, UK",53.4876981,-3.0398575
318,Blythe Bridge,"Blythe Bridge, Staffordshire, UK",52.969189,-2.072085
319,Bodmin Parkway,"Bodmin Parkway, Bodmin, Cornwall PL30, UK",50.4458497,-4.6629673
320,Bodorgan,"Bodorgan, Isle of Anglesey LL62, UK",53.1788254,-4.4166384
321,Bognor Regis,"Bognor Regis, West Sussex, UK",50.782998,-0.673061
322,Bogston,"Bogston, Greenock, Inverclyde PA15, UK",55.9370337,-4.7113813
323,Bolton,"Bolton, UK",53.584441,-2.428619
324,Bolton-On-Dearne,"Bolton upon Dearne, South Yorkshire, UK",53.518834,-1.316327
325,Bond Street,"Bond Street, London W1C, UK",51.51431,-0.1497
326,Bookham,"Great Bookham, Surrey, UK",51.2783826,-0.3733532
327,Bootle (Cumbria),"Bootle, Cumbria LA19, UK",54.281459,-3.371648
328,Bootle New Strand,"New Strand, Stanley Road, Bootle, Merseyside L20 2AB, UK",53.4519631,-2.9919934
329,Bootle Oriel Road,"Bootle Oriel Road, Bootle, Merseyside L20, UK",53.4466354,-2.9957326
330,Borough,"London Borough of Southwark, Greater London, UK",51.4834479,-0.0820877
331,Borough Green & Wrotham,"Borough Green & Wrotham, Borough Green, Kent TN15, UK",51.293216,0.3062724
332,Borth,"Borth, Ceredigion SY24, UK",52.488691,-4.051229
333,Bosham,"Bosham, West Sussex, UK",50.829002,-0.857678
334,Boston,"Boston, Lincolnshire, UK",52.97894,-0.026577
335,Boston Manor,"Manor Lane, Wrangle, Boston, Lincolnshire PE22 9DE, UK",53.0462261,0.1072681
336,Botley,"Botley, Hampshire SO30, UK",50.915254,-1.270672
337,Bottesford,"Bottesford, Leicestershire NG13, UK",52.940232,-0.802883
338,Bounds Green,"Bounds Green, London N11, UK",51.60704,-0.12421
339,Bourne End,"Bourne End, Wooburn Green, Buckinghamshire SL8, UK",51.5765108,-0.7100694
340,Bournemouth,"Bournemouth, UK",50.719164,-1.880769
341,Bournville,"Bournville, Birmingham, West Midlands B30, UK",52.42372,-1.932732
342,Bow Brickhill,"Bow Brickhill, Milton Keynes MK17, UK",52.005118,-0.682991
343,Bow Church,"Bow Church, London E3, UK",51.52786,-0.02091
344,Bowes Park,"Bowes Park, London N11, UK",51.6070129,-0.1205567
345,Bowling,"Bowling, Glasgow, West Dunbartonshire G60, UK",55.9310715,-4.4938257
346,Bow Road,"Bow Road, London E3, UK",51.52694,-0.0251
347,Boxhill & Westhumble,"Boxhill & Westhumble, Dorking, Surrey RH5, UK",51.2540078,-0.3284669
348,Bracknell,"Bracknell, Bracknell Forest, UK",51.41604,-0.75398
349,Bradford Forster Square,"Bradford Forster Square, Bradford, West Yorkshire BD1, UK",53.7969376,-1.752965
350,Bradford Interchange,"Bradford Interchange, Bradford, West Yorkshire BD1, UK",53.7910885,-1.749599
351,Bradford-On-Avon,"Bradford-on-Avon, Wiltshire, UK",51.345178,-2.2525019
352,Brading,"Brading, Isle of Wight, UK",50.679825,-1.1445399
353,Bradley Lane,"Bradley Lane, Stafford, Staffordshire ST18 9DN, UK",52.7695133,-2.1843647
354,Braintree,"Braintree, Essex, UK",51.880087,0.5509269
355,Braintree Freeport,"Braintree Freeport, Braintree, Essex CM77, UK",51.869424,0.5684633
356,Bramhall,"Bramhall, UK",53.367647,-2.164072
357,Bramley (Hampshire),"Bramley, Hampshire, UK",51.3295419,-1.061968
358,Bramley (West Yorkshire),"Bramley, West Yorkshire, UK",53.8124,-1.6285
