Id,Station,Address,Latitude,Longitude
2124,Roding Valley,"Roding Valley High School, Loughton, Essex IG10, UK",51.6433208,0.0556611
2125,Rogart,"Rogart, Highland IV28, UK",58.0047258,-4.139955
2126,Rogerstone,"Rogerstone, Newport, UK",51.592432,-3.0599949
2127,Rolleston,"Rolleston-on-Dove, Staffordshire DE13, UK",52.845734,-1.651206
2128,Roman Bridge,"Roman Bridge, Inveraray, Argyll and Bute PA32 8XT, UK",56.1961408,-5.1328008
2129,Romford,"Romford, Greater London, UK",51.577076,0.178319
2130,Romiley,"Romiley, UK",53.414926,-2.077023
2131,Romsey,"Romsey, Hampshire SO51, UK",50.98893,-1.49658
2132,Roose,"Roose, Cumbria LA13, UK",54.1156021,-3.1902042
2133,Rose Grove,"Rose Street, La Crosse, WI 54603, USA",43.8550635,-91.2460615
2134,Rose Hill (Marple),"Rose Hill Marple, Marple SK6, UK",53.3962379,-2.0765204
2135,Rosyth,"Rosyth, Fife, UK",56.03647,-3.423064
2136,Rotherham Central,"Rotherham Central, Rotherham, South Yorkshire S60, UK",53.4322702,-1.3604359
2137,Rotherhithe,"Rotherhithe, London SE16, UK",51.498883,-0.046916
2138,Rotherhithe (Underground),"Rotherhithe, London SE16, UK",51.498883,-0.046916
2139,Roughton Road,"Roughton Road, Cromer, Norfolk NR27, UK",52.9180468,1.2998133
2140,Rowland's Castle,"Rowlands Castle, Hampshire PO9, UK",50.892059,-0.959088
2141,Rowley Regis,"Rowley Regis, West Midlands, UK",52.488674,-2.046085
2142,Royal Albert,"Royal Albert, London E16, UK",51.50835,0.04596
2143,Royal Oak,"Royal Oak, MI, USA",42.4894801,-83.1446485
2144,Royal Victoria,"Royal Victoria, London E16, UK",51.50933,0.01852
2145,Roy Bridge,"Roy Bridge, Highland PH31, UK",56.8883464,-4.8372311
2146,Roydon,"Roydon, Essex, UK",51.77296,0.03961
2147,Royston,"Royston, Hertfordshire SG8, UK",52.048142,-0.024066
2148,Ruabon,"Ruabon, Wrexham, UK",52.986544,-3.040724
2149,Rufford,"Rufford, Lancashire, UK",53.634841,-2.815405
2150,Rugby,"Rugby, Warwickshire, UK",52.370878,-1.265032
2151,Rugeley Town,"Rugeley, Staffordshire, UK",52.761515,-1.935967
2152,Rugeley Trent Valley,"Rugeley Trent Valley, Rugeley, Staffordshire WS15, UK",52.7696708,-1.9298467
2153,Ruislip,"Ruislip, Greater London, UK",51.5758719,-0.421236
2154,Ruislip Gardens,"Ruislip Gardens, Ruislip, Greater London HA4, UK",51.56073,-0.41069
2155,Ruislip Manor,"Ruislip Manor, Ruislip, Greater London HA4, UK",51.566754,-0.407218
2156,Runcorn,"Runcorn, Halton, UK",53.342078,-2.729673
2157,Runcorn East,"Runcorn East, Murdishaw, Runcorn, Halton WA7, UK",53.3275818,-2.6656975
2158,Ruskington,"Ruskington, Lincolnshire, UK",53.044392,-0.387468
2159,Russell Square,"Russell Square, London WC1N, UK",51.52307,-0.12426
2160,Ruswarp,"Ruswarp, North Yorkshire YO21, UK",54.4712666,-0.629533
2161,Rutherglen,"Rutherglen, South Lanarkshire, UK",55.828972,-4.2242689
2162,Ryde Esplanade,"Ryde Esplanade, Ryde, Isle of Wight PO33, UK",50.7328566,-1.1597609
2163,Ryde Pier Head,"Ryde Pier Head, Ryde PO33, UK",50.7391722,-1.1601156
2164,Ryder Brow,"Ryder Brow, Manchester M18, UK",53.4565937,-2.1730865
2165,Ryde St.John's Road,"Ryde St Johns Road, Ryde, Isle of Wight PO33, UK",50.7243532,-1.1565553
2166,Rye,"Rye, East Sussex TN31, UK",50.949708,0.73726
2167,Rye House,"Rye House, Hoddesdon, Hertfordshire EN11, UK",51.7694169,0.0056556
2168,Salford,"Salford, UK",53.488465,-2.2982969
2169,Salford Crescent,"Salford Crescent, Salford M6, UK",53.4866024,-2.2757476
2170,Salfords,"Salfords, Surrey RH1, UK",51.204263,-0.167968
2171,Salhouse,"Salhouse, Norfolk NR13, UK",52.673549,1.414819
2172,Salisbury,"Salisbury, Wiltshire, UK",51.068785,-1.794472
2173,Saltaire,"Saltaire, Shipley, West Yorkshire BD18, UK",53.836607,-1.785755
2174,Saltash,"Saltash, Cornwall, UK",50.40921,-4.21643
2175,Saltburn,"Saltburn-by-the-Sea, Redcar and Cleveland, UK",54.58156,-0.975134
2176,Saltcoats,"Saltcoats, North Ayrshire, UK",55.637652,-4.7834899
2177,Saltmarshe,"Saltmarshe, East Riding of Yorkshire DN14, UK",53.707495,-0.809741
2178,Salwick,"Salwick, Cottam, Lancashire PR4, UK",53.793258,-2.786723
2179,Sandal And Agbrigg,"Sandal & Agbrigg, Wakefield, West Yorkshire WF1, UK",53.6630936,-1.4814211
2180,Sandbach,"Sandbach, Cheshire East CW11, UK",53.146561,-2.367382
2181,Sanderstead,"Sanderstead, South Croydon, Greater London CR2, UK",51.334791,-0.081587
2182,Sandhills,"Sandhills, Surrey GU8, UK",51.133082,-0.662259
2183,Sandhurst,"Sandhurst, Bracknell Forest, UK",51.3462419,-0.804268
2184,Sandilands,"Sandilands, Lincolnshire LN12, UK",53.301993,0.290315
2185,Sandling,"Sandling, Maidstone, Kent ME14, UK",51.2942916,0.5198617
2186,Sandown,"Sandown, NH, USA",42.928698,-71.1870053
2187,Sandplace,"Sandplace, Looe, Cornwall PL13, UK",50.386738,-4.4645156
2188,Sandwell & Dudley,"Sandwell & Dudley, West Bromwich, West Midlands B70, UK",52.5086728,-2.0115899
2189,Sandwich,"Sandwich, Kent, UK",51.274017,1.337427
2190,Sandy,"Sandy, UT, USA",40.5725,-111.8597222
2191,Sankey For Penketh,"Penketh, Warrington, UK",53.3802153,-2.6474775
2192,Sanquhar,"Sanquhar, Dumfries and Galloway DG4, UK",55.368078,-3.926828
2193,Sarn,"Sarn, Bridgend CF32, UK",51.54036,-3.583936
2194,Saundersfoot,"Saundersfoot, Pembrokeshire, UK",51.709379,-4.699726
2195,Saunderton,"Saunderton, Buckinghamshire HP27, UK",51.711629,-0.850955
2196,Sawbridgeworth,"Sawbridgeworth, Hertfordshire, UK",51.81554,0.14721
2197,Saxilby,"Saxilby, Lincolnshire LN1, UK",53.270689,-0.666012
2198,Saxmundham,"Saxmundham, Suffolk IP17, UK",52.215855,1.488056
2199,Scarborough,"Scarborough, North Yorkshire, UK",54.283113,-0.399752
2200,Scotscalder,"Scotscalder, Halkirk, Highland KW12, UK",58.4829757,-3.5520573
2201,Scotstounhill,"Scotstounhill, Glasgow, Glasgow City G13, UK",55.8851337,-4.3528725
2202,Scunthorpe,"Scunthorpe, North Lincolnshire, UK",53.588646,-0.654413
2203,Seaburn,"Seaburn, Sunderland, Tyne and Wear SR6, UK",54.937048,-1.36909
2204,Seaburn (Metro),"Fulwell, Seaburn Metro (S-bound), Sunderland, Tyne and Wear SR6, UK",54.9293,-1.38563
2205,Seaford,"Seaford, East Sussex, UK",50.7734669,0.101108
2206,Seaforth & Litherland,"Seaforth & Litherland, Bootle, Merseyside L21, UK",53.466283,-3.005622
2207,Seaham,"Seaham, County Durham, UK",54.840346,-1.337517
2208,Seamer,"Seamer, North Yorkshire YO12, UK",54.236816,-0.441258
2209,Sea Mills,"Sea Mills, Bristol, City of Bristol BS9, UK",51.486406,-2.642269
2210,Seascale,"Seascale, Cumbria, UK",54.396774,-3.481608
2211,Seaton Carew,"Seaton Carew, Hartlepool TS25, UK",54.6607742,-1.1935112
2212,Seer Green,"Seer Green, Buckinghamshire, UK",51.617386,-0.601029
2213,Selby,"Selby, North Yorkshire YO8, UK",53.783524,-1.067189
2214,Selhurst,"Selhurst, London SE25, UK",51.3919257,-0.0882745
2215,Sellafield,"Sellafield, Cumbria CA20, UK",54.423856,-3.506257
2216,Selling,"Selling, Kent ME13, UK",51.270928,0.923566
2217,Selly Oak,"Selly Oak, Birmingham, West Midlands B29, UK",52.442696,-1.937655
2218,Settle,"Settle, North Yorkshire BD24, UK",54.068246,-2.277655
2219,Seven Kings,"Seven Kings, Ilford, Greater London IG3, UK",51.566967,0.093946
2220,Sevenoaks,"Sevenoaks, Kent, UK",51.27241,0.190898
2221,Seven Sisters,"Seven Sisters, South Downs National Park, Eastbourne, East Sussex BN20, UK",50.75,0.1833333
2222,Seven Sisters (Underground),"Seven Sisters, South Downs National Park, Eastbourne, East Sussex BN20, UK",50.75,0.1833333
2223,Severn Beach,"Severn Beach, South Gloucestershire, UK",51.562038,-2.6616749
2224,Severn Tunnel Junction,"Severn Tunnel Junction, Rogiet, Monmouthshire NP26, UK",51.5846754,-2.7778965
2225,Shadwell,"Shadwell, West Yorkshire LS17, UK",53.8537109,-1.478638
2226,Shadwell (Underground),"Shadwell, West Yorkshire LS17, UK",53.8537109,-1.478638
2227,Shalford,"Shalford, Surrey, UK",51.211585,-0.568357
2228,Shanklin,"Shanklin, Isle of Wight, UK",50.634675,-1.175199
2229,Shaw and Crompton,"Shaw and Crompton, UK",53.5831442,-2.0953755
2230,Shaw and Crompton,"Shaw and Crompton, UK",53.5831442,-2.0953755
2231,Shawford,"Shawford, Hampshire SO21, UK",51.016281,-1.334276
2232,Shawlands,"Shawlands, Glasgow, Glasgow City G43, UK",55.823309,-4.286046
2233,Sheerness-On-Sea,"Sheerness-On-Sea, Sheerness, Kent ME12, UK",51.4410627,0.7585629
2234,Sheffield,"Sheffield, South Yorkshire, UK",53.381129,-1.470085
2235,Shelford,"Shelford, Nottinghamshire NG12, UK",52.970413,-1.015633
2236,Shenfield,"Shenfield, Brentwood, Essex, UK",51.629698,0.319184
2237,Shenstone,"Shenstone, Staffordshire, UK",52.639578,-1.844023
2238,Shepherds Bush,"Shepherd's Bush, London W12, UK",51.504746,-0.22305
2239,Shepherds Bush Central,"Shepherds House, 2 Castlelaw, Penicuik, Midlothian EH26 0PB, UK",55.8601583,-3.2326384
2240,Shepherds Bush Market,"Shepherd's Bush Market, White City, London W12, UK",51.50558,-0.22635
2241,Shepherd's Well,"Shepherds Well, Shepherdswell, Kent CT15, UK",51.1884029,1.2299408
2242,Shepley,"Shepley, West Yorkshire, UK",53.58442,-1.704896
2243,Shepperton,"Shepperton, Surrey, UK",51.389617,-0.452653
2244,Shepreth,"Shepreth, Cambridgeshire SG8, UK",52.112547,0.032694
2245,Sherborne,"Sherborne, Dorset DT9, UK",50.947822,-2.5144829
2246,Sherburn-In-Elmet,"Sherburn in Elmet, North Yorkshire LS25, UK",53.796994,-1.249604
2247,Sheringham,"Sheringham, Norfolk, UK",52.944421,1.2109589
2248,Shettleston,"Shettleston, Glasgow, Glasgow City G32, UK",55.851431,-4.160531
2249,Shieldmuir,"Shieldmuir, Wishaw, North Lanarkshire ML2, UK",55.7774861,-3.9569802
2250,Shields Road,"Shields Road, Tyne and Wear, UK",54.9543169,-1.399816
2251,Shifnal,"Shifnal, Shropshire TF11, UK",52.66792,-2.3745599
2252,Shildon,"Shildon, County Durham, UK",54.633417,-1.654915
2253,Shiplake,"Shiplake, Oxfordshire RG9, UK",51.49883,-0.900405
2254,Shipley,"Shipley, West Yorkshire, UK",53.835927,-1.776978
2255,Shippea Hill,"Shippea Hill, Ely, Cambridgeshire CB7, UK",52.4302291,0.4133685
2256,Shipton,"Shipton, North Yorkshire YO30, UK",54.019576,-1.155738
2257,Shirebrook (Derbys),"Shirebrook, Derbyshire, UK",53.2019189,-1.217961
2258,Shirehampton,"Shirehampton, Bristol, City of Bristol, UK",51.489495,-2.680856
2259,Shireoaks,"Shireoaks, Nottinghamshire S81, UK",53.323384,-1.171695
2260,Shirley,"Shirley, West Midlands, UK",52.410447,-1.819373
2261,Shoeburyness,"Shoeburyness, Southend-on-Sea SS3, UK",51.531522,0.797853
2262,Sholing,"Sholing, Southampton, UK",50.9001,-1.3551
2263,Shoreditch,"Shoreditch, Taunton, Somerset TA3, UK",50.994405,-3.082239
2264,Shoreditch High Street,"Shoreditch High Street, London E1, UK",51.5234474,-0.077107
2265,Shoreham-By-Sea,"Shoreham-by-Sea, West Sussex, UK",50.8342086,-0.2715558
2266,Shoreham (Kent),"Shoreham (Kent), Sevenoaks, Kent TN14, UK",51.3322157,0.1889172
2267,Shortlands,"Shortlands, Bromley, Greater London BR2, UK",51.399212,0.004141
2268,Shotton,"Shotton, Flintshire CH5, UK",53.2133309,-3.043203
2269,Shotton Low Level,"Shotton, Flintshire CH5, UK",53.2133309,-3.043203
2270,Shotts,"Shotts, North Lanarkshire ML7, UK",55.8201295,-3.797864
2271,Shrewsbury,"Shrewsbury, Shropshire, UK",52.7073029,-2.7553268
2272,Sidcup,"Sidcup, Greater London, UK",51.4264863,0.1009392
2273,Sileby,"Sileby, Leicestershire, UK",52.729949,-1.110268
2274,Silecroft,"Silecroft, Cumbria LA18, UK",54.223614,-3.338478
2275,Silkstone Common,"Silkstone Common, South Yorkshire S75, UK",53.534694,-1.556352
2276,Silverdale,"Silverdale, Lancashire, UK",54.167465,-2.826756
2277,Silver Street,"Silver Street, London N18, UK",51.6146887,-0.067215
2278,Silvertown & City Airport,"London City Airport, London City Airport (LCY), London E16, UK",51.50341,0.04877
2279,Singer,"Singer, Clydebank, West Dunbartonshire G81, UK",55.9076644,-4.4054707
2280,Sittingbourne,"Sittingbourne, Kent, UK",51.340402,0.731596
2281,Skegness,"Skegness, Lincolnshire, UK",53.146403,0.337881
2282,Skewen,"Skewen, Neath Port Talbot, UK",51.660932,-3.841789
2283,Skipton,"Skipton, North Yorkshire, UK",53.963613,-2.0118809
2284,Slade Green,"Slade Green, Erith, Greater London DA8, UK",51.4677848,0.1905181
2285,Slaithwaite,"Slaithwaite, West Yorkshire HD7, UK",53.618498,-1.88121
2286,Slateford,"Slateford, Edinburgh, City of Edinburgh EH14, UK",55.930973,-3.238114
2287,Sleaford,"Sleaford, Lincolnshire NG34, UK",53.0003079,-0.40965
2288,Sleights,"Sleights, North Yorkshire, UK",54.450344,-0.662365
2289,Sloane Square,"Sloane Square, London SW1W 8EE, UK",51.4927684,-0.1570174
2290,Slough,"Slough, UK",51.5105384,-0.5950406
2291,Smallbrook Junction,"Smallbrook Junction, Ryde, Isle of Wight PO33, UK",50.7110893,-1.1541877
2292,Small Heath,"Small Heath, Birmingham, West Midlands B9, UK",52.474151,-1.855628
2293,Smethwick Galton Bridge,"Smethwick Galton Bridge, Smethwick, West Midlands B66, UK",52.5017945,-1.98049
2294,Smethwick Rolfe Street,"Smethwick Rolfe Street, Smethwick, West Midlands B66, UK",52.4963985,-1.9706382
2295,Smitham,"Smitham House, 127 Brighton Road, Coulsdon, Greater London CR5 2NJ, UK",51.3216576,-0.1369339
2296,Smithy Bridge,"Smithy Bridge, Littleborough OL15, UK",53.633268,-2.1135012
2297,Snaith,"Snaith, East Riding of Yorkshire DN14, UK",53.69109,-1.023942
2298,Snaresbrook,"Snaresbrook, London E11, UK",51.58068,0.02147
2299,Snodland,"Snodland, Kent, UK",51.3313,0.445068
2300,Snowdown,"Snowdown, Aylesham, Kent CT15, UK",51.2174563,1.2108959
2301,Soho Benson Road,"Soho Benson Road Station, Birmingham, West Midlands B18, UK",52.4969,-1.93115
2302,Sole Street,"Sole Street, Gravesend, Kent DA13, UK",51.3831433,0.3781258
2303,Solihull,"Solihull, West Midlands, UK",52.411811,-1.77761
2304,Somerleyton,"Somerleyton, Suffolk NR32, UK",52.515136,1.659901
2305,South Acton,"South Acton, London W3, UK",51.4996944,-0.2701345
2306,Southall,"Southall, Greater London, UK",51.511073,-0.377232
2307,Southampton Airport (Parkway),"Southampton Airport Parkway, Southampton Airport (SOU), Southampton, Hampshire SO18, UK",50.9508051,-1.3630863
2308,Southampton Central,"Southampton Central, Southampton SO15, UK",50.9074381,-1.4135874
2309,South Bank,"South Bank, London SE1, UK",51.504406,-0.1120964
2310,South Bermondsey,"South Bermondsey, London SE16, UK",51.4881348,-0.0546517
2311,Southbourne,"Southbourne, Bournemouth BH6, UK",50.7243,-1.79429
2312,Southbury,"Southbury, CT, USA",41.4793072,-73.2133715
2313,South Croydon,"South Croydon, Greater London, UK",51.357428,-0.098251
2314,South Ealing,"South Ealing, London W5, UK",51.501,-0.3074
2315,Southease,"Southease, East Sussex BN7, UK",50.830884,0.020901
2316,South Elmsall,"South Elmsall, West Yorkshire, UK",53.59673,-1.2831
2317,Southend Airport,"London Southend Airport (SEN), Southend-on-Sea, Essex SS2 6YF",51.5694679,0.7037258
2318,Southend Central,"Southend Central, Southend-on-Sea SS1, UK",51.5370666,0.711756
2319,Southend East,"Southend East, Southend-on-Sea SS1, UK",51.5389747,0.7318445
2320,Southend Victoria,"Southend Victoria, Southend-on-Sea SS2, UK",51.5415148,0.7115302
2321,Southfields,"Southfields, London SW18, UK",51.447491,-0.199689
2322,Southgate,"Southgate, Swansea, UK",51.5757809,-4.0882595
2323,South Greenford,"South Greenford, Perivale, Greater London UB6, UK",51.5337488,-0.3366817
2324,South Gyle,"South Gyle, Edinburgh, City of Edinburgh EH12, UK",55.934609,-3.306414
2325,South Hampstead,"Hampstead, London NW3, UK",51.5556715,-0.1762025
2326,South Harrow,"South Harrow, Harrow, Greater London HA2, UK",51.565344,-0.358728
2327,South Hylton,"South Hylton, Sunderland, Tyne and Wear, UK",54.904113,-1.447837
2328,South Kensington,"South Kensington, London SW7, UK",51.4941501,-0.1746853
2329,South Kenton,"South Kenton, Wembley, Greater London HA0, UK",51.5701748,-0.3084406
2330,South Merton,"South Merton, London SW20, UK",51.4029905,-0.2051329
2331,South Milford,"South Milford, North Yorkshire LS25, UK",53.77827,-1.2442979
2332,Southminster,"Southminster, Essex CM0, UK",51.662231,0.8300689
2333,Southport,"Southport, Merseyside, UK",53.645708,-3.010113
2334,South Quay,"South Quay, Isle of Dogs, London E14, UK",51.50005,-0.01611
2335,South Ruislip,"South Ruislip, Ruislip, Greater London HA4, UK",51.557321,-0.393025
2336,South Ruislip (Underground),"South Ruislip, Ruislip, Greater London HA4, UK",51.557321,-0.393025
2337,South Tottenham,"South Tottenham, London N15, UK",51.5819931,-0.0768372
2338,Southwark,"Southwark, London SE1, UK",51.502781,-0.087738
2339,Southwick,"Southwick, West Sussex, UK",50.8353139,-0.238234
2340,South Wigston,"South Wigston, Wigston, Leicestershire LE18, UK",52.580517,-1.12735
2341,South Wimbledon,"South Wimbledon, London SW19, UK",51.41531,-0.19198
2342,South Wingfield,"South Wingfield, Derbyshire DE55, UK",53.09617,-1.44045
2343,South Woodford,"South Woodford, London E18, UK",51.593384,0.020674
2344,South Woodham Ferrers,"South Woodham Ferrers, Essex, UK",51.6465,0.614665
2345,Sowerby Bridge,"Sowerby Bridge, West Yorkshire, UK",53.706709,-1.913411
2346,Spalding,"Spalding, Lincolnshire, UK",52.7901016,-0.1537024
2347,Spean Bridge,"Spean Bridge, Highland PH34, UK",56.895695,-4.915134
2348,Spital,"Spital, Highland KW1, UK",58.4662668,-3.4264992
2349,Spondon,"Spondon, Derby DE21, UK",52.9187079,-1.4044476
2350,Spooner Row,"Spooner Row, Norfolk NR18, UK",52.531307,1.087976
2351,Springburn,"Springburn, Glasgow, Glasgow City G21, UK",55.887201,-4.230802
2352,Springfield,"Springfield, MA, USA",42.1014831,-72.589811
2353,Spring Road,"Spring Road, Birmingham, West Midlands B28, UK",52.443429,-1.8373835
2354,Squires Gate,"Squires Gate, Blackpool FY4, UK",53.781783,-3.045988
2355,Stadium of Light,"Stadium of Light, Sunderland, Tyne and Wear SR5 1SU",54.914561,-1.388371
2356,Stafford,"Stafford, UK",52.806693,-2.12066
2357,Staines,"Staines-upon-Thames, Surrey, UK",51.43148,-0.515525
2358,St.Albans Abbey,"The Cathedral & Abbey Church of Saint Alban, Saint Albans, Hertfordshire AL1 1BY",51.7504588,-0.3423409
2359,St.Albans City,"Saint Albans, Hertfordshire, UK",51.752725,-0.339436
2360,Stallingborough,"Stallingborough, North East Lincolnshire, UK",53.58584,-0.186296
2361,Stalybridge,"Stalybridge, UK",53.483806,-2.0500759
2362,Stamford,"Stamford, Lincolnshire PE9, UK",52.651282,-0.480216
2363,Stamford Brook,"Stamford Brook, London W6, UK",51.49492,-0.24568
2364,Stamford Hill,"Stamford Hill, London N16, UK",51.5679868,-0.0729616
2365,St.Andrew's Road,"St Andrews Road, Bristol, City of Bristol BS11, UK",51.5127677,-2.6963175
2366,Stanford-Le-Hope,"Stanford-le-Hope, Thurrock, UK",51.514121,0.42854
2367,Stanhope,"Stanhope, County Durham DL13, UK",54.74946,-2.011302
2368,Stanlow & Thornton,"Stanlow & Thornton, Chester, Cheshire West and Chester CH2, UK",53.2783766,-2.8420513
2369,Stanmore,"Stanmore, Greater London, UK",51.616419,-0.319686
2370,St.Annes-On-The-Sea,"Saint Anne's on the Sea, Lancashire, UK",53.7587262,-3.0164238
2371,Stansted Airport,"Stansted Airport (STN), Enterprise House, Bassingbourn Rd, Stansted, Essex CM24 1QW",51.8874704,0.2382674
2372,Stansted Mountfitchet,"Stansted Mountfitchet, Essex CM24, UK",51.8978139,0.198703
2373,Staplehurst,"Staplehurst, Kent TN12, UK",51.162752,0.552848
2374,Stapleton Road,"Stapleton Road, Bristol, City of Bristol BS5, UK",51.467504,-2.5662176
2375,Starbeck,"Starbeck, Knaresborough, North Yorkshire HG2, UK",53.997288,-1.501581
2376,Starcross,"Starcross, Devon, UK",50.626973,-3.450557
2377,Star Lane,"Star Lane, London E16, UK",51.52079,0.00418
2378,St.Austell,"Saint Austell, Cornwall, UK",50.343571,-4.794703
2379,Staveley (Cumbria),"Staveley, Cumbria LA8, UK",54.377897,-2.817677
2380,St.Bees,"Saint Bees, Cumbria CA27, UK",54.489458,-3.589727
2381,St.Budeaux Ferry Road,"St Budeaux Ferry Road, Plymouth PL5, UK",50.4013768,-4.1868415
2382,St.Budeaux Victoria Road,"St Budeaux Victoria Road, Plymouth PL5, UK",50.4019953,-4.1874329
2383,St.Columb Road,"St Columb Road, Saint Columb, Cornwall TR9, UK",50.3990538,-4.9408208
2384,St.Denys,"St Denys, Southampton SO17, UK",50.9221788,-1.3877498
2385,Stechford,"Stechford, Birmingham, West Midlands B33, UK",52.48396,-1.807598
2386,Steeton & Silsden,"Steeton & Silsden, Keighley, West Yorkshire BD20, UK",53.9000445,-1.9447227
2387,St Enoch,"Saint-noch, 22290 Saint-Gilles-les-Bois, France",48.668579,-3.069163
2388,Stepney Green,"Stepney Green, London E1, UK",51.52186,-0.04657
2389,Stepps,"Stepps, North Lanarkshire G33, UK",55.887207,-4.147705
2390,St.Erth,"St Erth, Cornwall TR27, UK",50.166,-5.437
2391,Stevenage,"Stevenage, Hertfordshire, UK",51.903761,-0.196612
2392,Stevenston,"Stevenston, North Ayrshire, UK",55.641817,-4.76041
2393,Stewartby,"Stewartby, Bedford MK43, UK",52.070269,-0.514975
2394,Stewarton,"Stewarton, East Ayrshire KA3, UK",55.679957,-4.513587
2395,St George's,"St George's Holborn, Queen Square, London WC1N 3AH, UK",51.521034,-0.122362
2396,St George's Cross,"Saint George's, Herbert Road, Bray, Co. Wicklow, Ireland",53.203998,-6.1118179
2397,St.Germans,"St. Germans, Cornwall PL12, UK",50.3955007,-4.3104538
2398,St.Helens Central,"St Helens Central, Saint Helens, Merseyside WA10, UK",53.4531374,-2.7303037
2399,St.Helens Junction,"St Helens Junction, Saint Helens, Merseyside WA9, UK",53.43374,-2.7002585
2400,St.Helier,"Saint Helier JE2 3YA, Jersey",49.1868225,-2.1065682
2401,Stirling,"Stirling, UK",56.1165227,-3.9369029
2402,St.Ives,"St. Ives, Cornwall TR26, UK",50.2152089,-5.4777498
2403,St James Park,"St. James's Park, London SW1H, UK",51.49954,-0.13358
2404,St.James' Park,"St. James' Park, Newcastle upon Tyne, Tyne and Wear NE1 4ST",54.9754057,-1.622853
2405,St.James' Street,"Saint James' Street, Paisley, Renfrewshire PA3 2JR, UK",55.8483199,-4.428174
2406,St.John's,"St. John's, NL, Canada",47.5605413,-52.7128315
2407,St Johns Wood,"St. John's Wood, London NW8, UK",51.53452,-0.17392
2408,St.Keyne,"St Keyne, Cornwall PL14, UK",50.4166667,-4.4666667
2409,St.Leonards Warrior Square,"St Leonards Warrior Square, Saint Leonards, East Sussex TN37, UK",50.8556893,0.5603087
2410,St.Margaret's (Greater London),"Saint Margarets, Isleworth, Greater London TW1, UK",51.457939,-0.326468
2411,St.Margaret's (Hertfordshire),"Stanstead St Margarets, Hertfordshire SG12, UK",51.7879252,-0.0015246
2412,St.Mary Cray,"Saint Mary Cray, Orpington, Greater London BR5, UK",51.385993,0.113061
2413,St.Michaels,"St Michaels, Liverpool, Merseyside L17, UK",53.3756144,-2.9527982
2414,St.Neots,"Saint Neots, Cambridgeshire PE19, UK",52.2280945,-0.2715215
2415,Stockport,"Stockport, UK",53.406754,-2.158843
2416,Stocksfield,"Stocksfield, Northumberland NE43, UK",54.947653,-1.906376
2417,Stocksmoor,"Stocksmoor, West Yorkshire HD4, UK",53.5938249,-1.7259922
2418,Stockton,"Stockton, CA, USA",37.9577016,-121.2907796
2419,Stockwell,"Stockwell, London SW9, UK",51.468813,-0.125439
2420,Stoke Mandeville,"Stoke Mandeville, Buckinghamshire, UK",51.786027,-0.791595
2421,Stoke Newington,"Stoke Newington, London Borough of Hackney, London N16, UK",51.559298,-0.083083
2422,Stoke-On-Trent,"Stoke-on-Trent, UK",53.002668,-2.179404
2423,Stone,"Mirond Lake, Division No. 18, Unorganized, SK S0P, Canada",55.1041222,-102.7701482
2424,Stonebridge Park,"Stonebridge Park, London NW10, UK",51.5440331,-0.27601
2425,Stone Crossing,"Stone Crossing, Dartford, Kent DA9, UK",51.4513283,0.2637994
2426,Stonegate,"Stonegate, East Sussex TN5, UK",51.032643,0.377399
2427,Stonehaven,"Stonehaven, Aberdeenshire, UK",56.963661,-2.209288
2428,Stonehouse,"Stonehouse, Gloucestershire GL10, UK",51.743881,-2.279028
2429,Stoneleigh,"Stoneleigh, Warwickshire CV8, UK",52.352113,-1.517514
2430,Stourbridge Junction,"Stourbridge Junction, Stourbridge, West Midlands DY9, UK",52.4475545,-2.1338703
2431,Stourbridge Town,"Stourbridge, West Midlands, UK",52.456891,-2.148731
2432,Stowmarket,"Stowmarket, Suffolk IP14, UK",52.188902,0.997712
2433,St Pancras International,"St Pancras International (Stop A), London NW1, UK",51.529247,-0.125678
2434,St Pancras International (Ctrl),"International House, 16 Priestley Way, London NW2 7AP, UK",51.5700686,-0.2381947
2435,St Pauls,"St. Paul's Cathedral, St. Paul's Churchyard, London EC4M 8AD, UK",51.5138453,-0.0983506
2436,St Paul's,"St. Paul's Cathedral, St. Paul's Churchyard, London EC4M 8AD, UK",51.5138453,-0.0983506
2437,St Peters,"St. Peters, MO, USA",38.7874699,-90.6298922
2438,Stranraer,"Stranraer, Dumfries and Galloway, UK",54.903367,-5.024055
2439,Stratford,"Stratford, London E15, UK",51.54327,-0.00187
2440,Stratford (DLR),"Stratford, London E15, UK",51.54327,-0.00187
2441,Stratford High Street,"Stratford High Street, London E15, UK",51.5382,-0.00105
2442,Stratford International,"Stratford International, London E20, UK",51.5448284,-0.0087498
2443,Stratford (Underground),"Stratford Underground Station, London E15 1BB, UK",51.5436184,0.0019717
2444,Stratford-Upon-Avon,"Stratford-upon-Avon, Warwickshire CV37, UK",52.19173,-1.708298
2445,Strathcarron,"Strathcarron, Highland IV54, UK",57.424497,-5.428393
2446,Strawberry Hill,"Strawberry Hill, Twickenham, Greater London TW2, UK",51.4396739,-0.339603
2447,Streatham,"Streatham, London SW16, UK",51.431183,-0.131745
2448,Streatham Common,"Streatham Common, London SW16, UK",51.4187281,-0.1359838
2449,Streatham Hill,"Streatham Hill, London, UK",51.444849,-0.124931
2450,Streethouse,"Streethouse, West Yorkshire, UK",53.675677,-1.410968
2451,Strines,"Strines, Marple SK22, UK",53.37795,-2.043905
2452,Stromeferry,"Stromeferry, Highland IV53, UK",57.352444,-5.551392
2453,Strood,"Strood, Rochester, Medway ME2, UK",51.39247,0.478497
2454,Stroud,"Stroud, Gloucestershire, UK",51.745734,-2.217758
2455,Sturry,"Sturry, Kent, UK",51.303576,1.121071
2456,Styal,"Styal, Cheshire East SK9, UK",53.35018,-2.251748
2457,Sudbury,"Greater Sudbury, ON, Canada",46.49,-81.01
2458,Sudbury & Harrow Road,"Sudbury & Harrow Road, Wembley, Greater London HA0, UK",51.5543984,-0.3154453
2459,Sudbury Hill,"Sudbury Hill, Harrow, Greater London UB6, UK",51.55695,-0.33641
2460,Sudbury Hill Harrow,"Sudbury Hill, Harrow, Greater London UB6, UK",51.55695,-0.33641
2461,Sudbury Town,"Greater Sudbury, ON, Canada",46.49,-81.01
2462,Sugar Loaf,"Sugar Loaf, Brecon Beacons National Park, Abergavenny, Monmouthshire NP7, UK",51.8627222,-3.0578611
2463,Summerston,"Summerston, Glasgow, Glasgow City G20, UK",55.8988291,-4.2915238
2464,Sunbury,"Sunbury, Surrey TW16, UK",51.403928,-0.412932
